{
    "name": "John Doe",
    "age": 30,
    "email": "john@example.com",
    "preferences": {
        "notifications": true,
        "theme": "light"
    },
    "tags": [
        "tag1",
        "tag2"
    ],
    "metadata": {
        "created": "2021-01-01T00:00:00Z",
        "updated": "2022-01-01T00:00:00Z"
    },
    "data": "eyJmb28iOiJ0ZXN0IiwiYmFyIjo0Mn0=",
    "status": "active"
}
